

console:/data # ./lspci [keymint-sb  ][ 238.415687] !!! No keymint functions available
-vvv
0000:00:00.0 Class 0604: Device 144d:ecee (rev 01)
        Control: I/O+ Mem+ BusMaster+ SpecCycle- MemWINV- VGASnoop- ParErr- Stepping- SERR+ FastB2B- DisINTx-
        Status: Cap+ 66MHz- UDF- FastB2B- ParErr- DEVSEL=fast >TAbort- <TAbort- <MAbort- >SERR+ <PERR- INTx-
        Latency: 0
        Bus: primary=00, secondary=01, subordinate=ff, sec-latency=0
        I/O behind bridge: 00000000-00000fff
        Memory behind bridge: 00000000-000fffff
        Prefetchable memory behind bridge: 0000000000000000-00000000000fffff
        Secondary status: 66MHz- FastB2B- ParErr- DEVSEL=fast >TAbort- <TAbort- <MAbort- <SERR- <PERR-
        BridgeCtl: Parity- SERR- NoISA- VGA- MAbort- >Reset- FastB2B-
                PriDiscTmr- SecDiscTmr- DiscTmrStat- DiscTmrSERREn-
        Capabilities: [40] Power Management version 3
                Flags: PMEClk- DSI- D1+ D2- AuxCurrent=375mA PME(D0+,D1+,D2-,D3hot+,D3cold+)
                Status: D0 NoSoftRst- PME-Enable- DSel=0 DScale=0 PME-
        Capabilities: [50] MSI: Enable- Count=1/32 Maskable+ 64bit+
                Address: 0000000000000000  Data: 0000
                Masking: 00000000  Pending: 00000000
        Capabilities: [70] Express (v2) Root Port (Slot-), MSI 00
                DevCap: MaxPayload 1024 bytes, PhantFunc 0, Latency L0s <64ns, L1 <1us
                        ExtTag+ RBE+ FLReset-
                DevCtl: Report errors: Correctable- Non-Fatal- Fatal- Unsupported-
                        RlxdOrd+ ExtTag+ PhantFunc- AuxPwr- NoSnoop-
                        MaxPayload 128 bytes, MaxReadReq 512 bytes
                DevSta: CorrErr- UncorrErr+ FatalErr- UnsuppReq+ AuxPwr+ TransPend-
                LnkCap: Port #0, Speed unknown, Width x0, ASPM unknown, Latency L0 <4us, L1 unlimited
                        ClockPM- Surprise- LLActRep+ BwNot+
                LnkCtl: ASPM Disabled; RCB 64 bytes Disabled- Retrain- CommClk+
                        ExtSynch- ClockPM- AutWidDis- BWInt- AutBWInt-
                LnkSta: Speed 5GT/s, Width x1, TrErr- Train- SlotClk+ DLActive+ BWMgmt+ ABWMgmt+
                RootCtl: ErrCorrectable- ErrNon-Fatal- ErrFatal- PMEIntEna- CRSVisible+
                RootCap: CRSVisible-
                RootSta: PME ReqID 0000, PMEStatus- PMEPending-
                DevCap2: Completion Timeout: Range ABCD, TimeoutDis+ ARIFwd-
                DevCtl2: Completion Timeout: 50us to 50ms, TimeoutDis- ARIFwd-
                LnkCtl2: Target Link Speed: Unknown, EnterCompliance- SpeedDis-, Selectable De-emphasis: -6dB
                         Transmit Margin: Normal Operating Range, EnterModifiedCompliance- ComplianceSOS-
                         Compliance De-emphasis: -6dB
                LnkSta2: Current De-emphasis Level: -6dB
        Capabilities: [b0] MSI-X: Enable- Count=32 Masked-
                Vector table: BAR=5 offset=00000000
                PBA: BAR=5 offset=00010000
        Capabilities: [100 v2] Advanced Error Reporting
                UESta:  DLP- SDES- TLP- FCP- CmpltTO- CmpltAbrt- UnxCmplt- RxOF- MalfTLP- ECRC- UnsupReq+ ACSViol-
                UEMsk:  DLP- SDES- TLP- FCP- CmpltTO- CmpltAbrt- UnxCmplt- RxOF- MalfTLP- ECRC- UnsupReq- ACSViol-
                UESvrt: DLP+ SDES+ TLP- FCP+ CmpltTO- CmpltAbrt- UnxCmplt- RxOF+ MalfTLP+ ECRC- UnsupReq- ACSViol-
                CESta:  RxErr- BadTLP- BadDLLP- Rollover- Timeout- NonFatalErr-
                CEMsk:  RxErr- BadTLP- BadDLLP- Rollover- Timeout- NonFatalErr+
                AERCap: First Error Pointer: 14, GenCap+ CGenEn- ChkCap+ ChkEn-
        Capabilities: [158 v1] #19
        Capabilities: [168 v1] #26
        Capabilities: [18c v1] #27
        Capabilities: [19c v1] #2a
        Capabilities: [208 v1] #1e
        Capabilities: [218 v1] Vendor Specific Information: ID=0002 Rev=4 Len=100 <?>
        Capabilities: [318 v1] #25
        Capabilities: [324 v1] Vendor Specific Information: ID=0006 Rev=0 Len=018 <?>
        Kernel driver in use: pcieport

0000:01:00.0 Class 0280: Device 12be:bd31 (rev 02)
        Subsystem: Device 12be:bd31
        Control: I/O- Mem- BusMaster- SpecCycle- MemWINV- VGASnoop- ParErr- Stepping- SERR- FastB2B- DisINTx-
        Status: Cap+ 66MHz- UDF- FastB2B- ParErr- DEVSEL=fast >TAbort- <TAbort- <MAbort- >SERR- <PERR- INTx-
        Interrupt: pin A routed to IRQ 0
        Region 0: Memory at 60800000 (64-bit, non-prefetchable) [disabled] [size=64K]
        Region 2: Memory at 60000000 (64-bit, non-prefetchable) [disabled] [size=8M]
        Capabilities: [48] Power Management version 3
                Flags: PMEClk- DSI- D1+ D2+ AuxCurrent=0mA PME(D0-,D1-,D2-,D3hot-,D3cold-)
                Status: D0 NoSoftRst+ PME-Enable+ DSel=0 DScale=2 PME-
        Capabilities: [58] MSI: Enable- Count=1/32 Maskable- 64bit+
                Address: 0000000000000000  Data: 0000
        Capabilities: [68] Vendor Specific Information: Len=38 <?>
        Capabilities: [a0] MSI-X: Enable- Count=64 Masked-
                Vector table: BAR=0 offset=00008000
                PBA: BAR=0 offset=00008800
        Capabilities: [ac] Express (v2) Endpoint, MSI 00
                DevCap: MaxPayload 512 bytes, PhantFunc 0, Latency L0s <4us, L1 unlimited
                        ExtTag- AttnBtn- AttnInd- PwrInd- RBE+ FLReset+
                DevCtl: Report errors: Correctable- Non-Fatal- Fatal- Unsupported-
                        RlxdOrd+ ExtTag- PhantFunc- AuxPwr+ NoSnoop+ FLReset-
                        MaxPayload 128 bytes, MaxReadReq 512 bytes
                DevSta: CorrErr- UncorrErr- FatalErr- UnsuppReq- AuxPwr+ TransPend-
                LnkCap: Port #0, Speed 5GT/s, Width x1, ASPM L0s L1, Latency L0 <2us, L1 <32us
                        ClockPM+ Surprise- LLActRep- BwNot-
                LnkCtl: ASPM Disabled; RCB 64 bytes Disabled- Retrain- CommClk+
                        ExtSynch- ClockPM- AutWidDis- BWInt- AutBWInt-
                LnkSta: Speed 5GT/s, Width x1, TrErr- Train- SlotClk+ DLActive- BWMgmt- ABWMgmt-
                DevCap2: Completion Timeout: Range ABCD, TimeoutDis+
                DevCtl2: Completion Timeout: 50us to 50ms, TimeoutDis-
                LnkCtl2: Target Link Speed: 2.5GT/s, EnterCompliance- SpeedDis-, Selectable De-emphasis: -6dB
                         Transmit Margin: Normal Operating Range, EnterModifiedCompliance- ComplianceSOS-
                         Compliance De-emphasis: -6dB
                LnkSta2: Current De-emphasis Level: -6dB
        Capabilities: [100 v1] Advanced Error Reporting
                UESta:  DLP- SDES- TLP- FCP- CmpltTO- CmpltAbrt- UnxCmplt- RxOF- MalfTLP- ECRC- UnsupReq- ACSViol-
                UEMsk:  DLP- SDES- TLP- FCP- CmpltTO- CmpltAbrt- UnxCmplt- RxOF- MalfTLP- ECRC- UnsupReq- ACSViol-
                UESvrt: DLP+ SDES+ TLP- FCP+ CmpltTO- CmpltAbrt- UnxCmplt- RxOF+ MalfTLP+ ECRC- UnsupReq- ACSViol-
                CESta:  RxErr- BadTLP- BadDLLP- Rollover- Timeout- NonFatalErr-
                CEMsk:  RxErr- BadTLP- BadDLLP- Rollover- Timeout- NonFatalErr+
                AERCap: First Error Pointer: 00, GenCap+ CGenEn- ChkCap+ ChkEn-
        Capabilities: [13c v1] Device Serial Number 00-00-00-ff-ff-00-00-00
        Capabilities: [150 v1] Power Budgeting <?>
        Capabilities: [160 v1] Virtual Channel
                Caps:   LPEVC=0 RefClk=100ns PATEntryBits=1
                Arb:    Fixed- WRR32- WRR64- WRR128-
                Ctrl:   ArbSelect=Fixed
                Status: InProgress-
                VC0:    Caps:   PATOffset=00 MaxTimeSlots=1 RejSnoopTrans-
                        Arb:    Fixed- WRR32- WRR64- WRR128- TWRR128- WRR256-
                        Ctrl:   Enable+ ID=0 ArbSelect=Fixed TC/VC=ff
                        Status: NegoPending- InProgress-
        Capabilities: [1b0 v1] Latency Tolerance Reporting
                Max snoop latency: 0ns
                Max no snoop latency: 0ns
        Capabilities: [220 v1] #15
        Capabilities: [240 v1] #1e
        Capabilities: [200 v1] #1f

0001:00:00.0 Class 0604: Device 144d:ecef (rev 01)
        Control: I/O+ Mem+ BusMaster+ SpecCycle- MemWINV- VGASnoop- ParErr- Stepping- SERR+ FastB2B- DisINTx-
        Status: Cap+ 66MHz- UDF- FastB2B- ParErr- DEVSEL=fast >TAbort- <TAbort- <MAbort- >SERR+ <PERR- INTx-
        Latency: 0
        Bus: primary=00, secondary=01, subordinate=ff, sec-latency=0
        I/O behind bridge: 00000000-00000fff
        Memory behind bridge: 00000000-000fffff
        Prefetchable memory behind bridge: 0000000000000000-00000000000fffff
        Secondary status: 66MHz- FastB2B- ParErr- DEVSEL=fast >TAbort- <TAbort- <MAbort- <SERR- <PERR-
        BridgeCtl: Parity- SERR- NoISA- VGA- MAbort- >Reset- FastB2B-
                PriDiscTmr- SecDiscTmr- DiscTmrStat- DiscTmrSERREn-
        Capabilities: [40] Power Management version 3
                Flags: PMEClk- DSI- D1+ D2- AuxCurrent=375mA PME(D0+,D1+,D2-,D3hot+,D3cold+)
                Status: D0 NoSoftRst- PME-Enable- DSel=0 DScale=0 PME-
        Capabilities: [50] MSI: Enable- Count=1/32 Maskable+ 64bit+
                Address: 0000000000000000  Data: 0000
                Masking: 00000000  Pending: 00000000
        Capabilities: [70] Express (v2) Root Port (Slot-), MSI 00
                DevCap: MaxPayload 1024 bytes, PhantFunc 0, Latency L0s <64ns, L1 <1us
                        ExtTag- RBE+ FLReset-
                DevCtl: Report errors: Correctable- Non-Fatal- Fatal- Unsupported-
                        RlxdOrd+ ExtTag- PhantFunc- AuxPwr- NoSnoop-
                        MaxPayload 128 bytes, MaxReadReq 512 bytes
                DevSta: CorrErr- UncorrErr+ FatalErr- UnsuppReq+ AuxPwr+ TransPend-
                LnkCap: Port #0, Speed unknown, Width x0, ASPM unknown, Latency L0 <4us, L1 unlimited
                        ClockPM- Surprise- LLActRep+ BwNot+
                LnkCtl: ASPM Disabled; RCB 64 bytes Disabled- Retrain- CommClk+
                        ExtSynch- ClockPM- AutWidDis- BWInt- AutBWInt-
                LnkSta: Speed 5GT/s, Width x1, TrErr- Train- SlotClk+ DLActive+ BWMgmt+ ABWMgmt+
                RootCtl: ErrCorrectable- ErrNon-Fatal- ErrFatal- PMEIntEna- CRSVisible+
                RootCap: CRSVisible-
                RootSta: PME ReqID 0000, PMEStatus- PMEPending-
                DevCap2: Completion Timeout: Range ABCD, TimeoutDis+ ARIFwd-
                DevCtl2: Completion Timeout: 50us to 50ms, TimeoutDis- ARIFwd-
                LnkCtl2: Target Link Speed: Unknown, EnterCompliance- SpeedDis-, Selectable De-emphasis: -6dB
                         Transmit Margin: Normal Operating Range, EnterModifiedCompliance- ComplianceSOS-
                         Compliance De-emphasis: -6dB
                LnkSta2: Current De-emphasis Level: -6dB
        Capabilities: [b0] MSI-X: Enable- Count=32 Masked-
                Vector table: BAR=5 offset=00000000
                PBA: BAR=5 offset=00010000
        Capabilities: [100 v2] Advanced Error Reporting
                UESta:  DLP- SDES- TLP- FCP- CmpltTO- CmpltAbrt- UnxCmplt- RxOF- MalfTLP- ECRC- UnsupReq+ ACSViol-
                UEMsk:  DLP- SDES- TLP- FCP- CmpltTO- CmpltAbrt- UnxCmplt- RxOF- MalfTLP- ECRC- UnsupReq- ACSViol-
                UESvrt: DLP+ SDES+ TLP- FCP+ CmpltTO- CmpltAbrt- UnxCmplt- RxOF+ MalfTLP+ ECRC- UnsupReq- ACSViol-
                CESta:  RxErr- BadTLP- BadDLLP- Rollover- Timeout- NonFatalErr-
                CEMsk:  RxErr- BadTLP- BadDLLP- Rollover- Timeout- NonFatalErr+
                AERCap: First Error Pointer: 14, GenCap+ CGenEn- ChkCap+ ChkEn-
        Capabilities: [158 v1] #19
        Capabilities: [168 v1] #26
        Capabilities: [18c v1] #27
        Capabilities: [198 v1] #2a
        Capabilities: [204 v1] #1e
        Capabilities: [214 v1] Vendor Specific Information: ID=0002 Rev=4 Len=100 <?>
        Capabilities: [314 v1] #25
        Capabilities: [320 v1] Vendor Specific Information: ID=0006 Rev=0 Len=018 <?>
        Kernel driver in use: pcieport

0001:01:00.0 Class 0280: Device 12be:bd31 (rev 02)
        Subsystem: Device 12be:bd31
        Control: I/O- Mem- BusMaster- SpecCycle- MemWINV- VGASnoop- ParErr- Stepping- SERR- FastB2B- DisINTx-
        Status: Cap+ 66MHz- UDF- FastB2B- ParErr- DEVSEL=fast >TAbort- <TAbort- <MAbort- >SERR- <PERR- INTx-
        Interrupt: pin A routed to IRQ 0
        Region 0: Memory at 70800000 (64-bit, non-prefetchable) [disabled] [size=64K]
        Region 2: Memory at 70000000 (64-bit, non-prefetchable) [disabled] [size=8M]
        Capabilities: [48] Power Management version 3
                Flags: PMEClk- DSI- D1+ D2+ AuxCurrent=0mA PME(D0-,D1-,D2-,D3hot-,D3cold-)
                Status: D0 NoSoftRst+ PME-Enable+ DSel=0 DScale=2 PME-
        Capabilities: [58] MSI: Enable- Count=1/32 Maskable- 64bit+
                Address: 0000000000000000  Data: 0000
        Capabilities: [68] Vendor Specific Information: Len=38 <?>
        Capabilities: [a0] MSI-X: Enable- Count=64 Masked-
                Vector table: BAR=0 offset=00008000
                PBA: BAR=0 offset=00008800
        Capabilities: [ac] Express (v2) Endpoint, MSI 00
                DevCap: MaxPayload 512 bytes, PhantFunc 0, Latency L0s <4us, L1 unlimited
                        ExtTag- AttnBtn- AttnInd- PwrInd- RBE+ FLReset+
                DevCtl: Report errors: Correctable- Non-Fatal- Fatal- Unsupported-
                        RlxdOrd+ ExtTag- PhantFunc- AuxPwr+ NoSnoop+ FLReset-
                        MaxPayload 128 bytes, MaxReadReq 512 bytes
                DevSta: CorrErr- UncorrErr- FatalErr- UnsuppReq- AuxPwr+ TransPend-
                LnkCap: Port #0, Speed 5GT/s, Width x1, ASPM L0s L1, Latency L0 <2us, L1 <32us
                        ClockPM+ Surprise- LLActRep- BwNot-
                LnkCtl: ASPM Disabled; RCB 64 bytes Disabled- Retrain- CommClk+
                        ExtSynch- ClockPM- AutWidDis- BWInt- AutBWInt-
                LnkSta: Speed 5GT/s, Width x1, TrErr- Train- SlotClk+ DLActive- BWMgmt- ABWMgmt-
                DevCap2: Completion Timeout: Range ABCD, TimeoutDis+
                DevCtl2: Completion Timeout: 50us to 50ms, TimeoutDis-
                LnkCtl2: Target Link Speed: 2.5GT/s, EnterCompliance- SpeedDis-, Selectable De-emphasis: -6dB
                         Transmit Margin: Normal Operating Range, EnterModifiedCompliance- ComplianceSOS-
                         Compliance De-emphasis: -6dB
                LnkSta2: Current De-emphasis Level: -6dB
        Capabilities: [100 v1] Advanced Error Reporting
                UESta:  DLP- SDES- TLP- FCP- CmpltTO- CmpltAbrt- UnxCmplt- RxOF- MalfTLP- ECRC- UnsupReq- ACSViol-
                UEMsk:  DLP- SDES- TLP- FCP- CmpltTO- CmpltAbrt- UnxCmplt- RxOF- MalfTLP- ECRC- UnsupReq- ACSViol-
                UESvrt: DLP+ SDES+ TLP- FCP+ CmpltTO- CmpltAbrt- UnxCmplt- RxOF+ MalfTLP+ ECRC- UnsupReq- ACSViol-
                CESta:  RxErr- BadTLP- BadDLLP- Rollover- Timeout- NonFatalErr-
                CEMsk:  RxErr- BadTLP- BadDLLP- Rollover- Timeout- NonFatalErr+
                AERCap: First Error Pointer: 00, GenCap+ CGenEn- ChkCap+ ChkEn-
        Capabilities: [13c v1] Device Serial Number 00-00-00-ff-ff-00-00-00
        Capabilities: [150 v1] Power Budgeting <?>
        Capabilities: [160 v1] Virtual Channel
                Caps:   LPEVC=0 RefClk=100ns PATEntryBits=1
                Arb:    Fixed- WRR32- WRR64- WRR128-
                Ctrl:   ArbSelect=Fixed
                Status: InProgress-
                VC0:    Caps:   PATOffset=00 MaxTimeSlots=1 RejSnoopTrans-
                        Arb:    Fixed- WRR32- WRR64- WRR128- TWRR128- WRR256-
                        Ctrl:   Enable+ ID=0 ArbSelect=Fixed TC/VC=ff
                        Status: NegoPending- InProgress-
        Capabilities: [1b0 v1] Latency Tolerance Reporting
                Max snoop latency: 0ns
                Max no snoop latency: 0ns
        Capabilities: [220 v1] #15
        Capabilities: [240 v1] #1e
        Capabilities: [200 v1] #1f
		
==================================================================		
		
# zcat /proc/config.gz | grep CONFIG_PCIEASPM
O/p - 
CONFIG_PCIEASPM=y
CONFIG_PCIEASPM_DEFAULT=y
# CONFIG_PCIEASPM_POWERSAVE is not set
# CONFIG_PCIEASPM_POWER_SUPERSAVE is not set
# CONFIG_PCIEASPM_PERFORMANCE is not set

# cat /sys/module/pcie_aspm/parameters/policy
O/p - 
[default] performance powersave powersupersave